181,,广州市思钡装饰工程有限公司,杨立雄,广东省,001607220057304200,
184,,湖北瑞利装饰工程有限公司,叶凌,湖北省,001607220057374206,
185,91420500682686344U,宜昌福润建筑装饰工程有限公司,毛芹,湖北省,001607220057244187,
186,,北京福展祥瑞国际展览有限公司,赵顺涛,北京市,001607220057309828,
187,,河南浩达装饰有限公司,李利萍,河南省,001607220057251891,
188,91410105271741249Y,河南祥远装饰工程有限公司,王文兴,河南省,001607220057256603,
189,914101007967955572,郑州恒兴科技工程有限责任公司,普永超,河南省,001607220057234217,
190,91371400774168659A,德州天宇空调设备有限公司,葛跃国,山东省,001607220057203722,
191,91370600683244230A,烟台帝景装饰工程有限公司,李友军,山东省,001607220057312055,
211,913201157331892507,南京辰邦装饰工程有限责任公司,邱旭,江苏省,001607220057396283,
212,91442000771885169A,中山市洪涛装饰工程有限公司,李坤明,广东省,001607220057205036,
233,91410100580323198M,河南鼎亨装饰工程有限公司,陈捍卫,河南省,001607220057338475,
237,91510000746913383D,四川富纬欣叶建筑装饰工程有限公司,徐茂奇,四川省,001607220057278942,
238,,四川森伟消防工程有限公司,张芝全,四川省,001607220057325123,
239,91310230577497111K,上海银瀚装饰设计工程有限公司,马乾,上海市,001607220057389362,
240,91310112599780938F,上海海铸建筑装饰设计工程有限公司,陶清林,上海市,001607220057347902,
271,,苏州佳达建设工程有限公司,吴佳,江苏省,001607220057381315,
272,,广西防城港柏达龙凤装饰工程有限公司,陈炯志,广西壮族自治区,001607220057351492,
273,,北京石谷联创建筑装饰工程有限公司,张晓英,北京市,001607220057281390,
274,,南京第五十五所技术开发有限公司,铁斌,江苏省,001607220057249250,
275,91410100577624694X,河南中环艺建筑装饰工程设计有限公司,魏栋,河南省,001607220057278545,
276,,珠海羿天装饰设计工程有限公司,张德春,广东省,001607220057195163,
277,,贵州红双吉展览装饰工程有限公司,柳大建,贵州省,001607220057360426,
278,911501055669397037,内蒙古金亚装饰工程有限公司,叶玲芳,内蒙古自治区,001607220057360408,
279,91150102664074491G,内蒙古尖锋科技有限公司,高广和,内蒙古自治区,001607220057224348,
280,91430600053882721L,湖南中发建设工程有限公司,李光盈,湖南省,001607220057310802,
281,,珠海市合讯建筑装饰工程有限公司,张国威,广东省,001607220057287465,
282,91320118721786744M,南京沧溪建设工程有限公司,李期军,江苏省,001607220057238521,
283,91440400559144523L,珠海市新永诚建筑工程有限公司,秦克永,广东省,001607220057273306,
284,,河南中跃装饰工程有限公司,郭晓东,河南省,001607220057336571,
285,9134018174487099X9,佳伟建设集团有限公司,杨家伟,安徽省,001607220057388319,
286,91330902148743222Y,舟山市益民建筑安装工程有限公司,许通定,浙江省,001607220057242864,
287,91430600186093662L,岳阳城市建设安装有限公司,蒋跃武,湖南省,001607220057293047,
288,,宁波普伦祥装饰工程有限公司,张时光,浙江省,001607220057367878,
289,91340000148943128R,安徽安兴高科技有限责任公司,吴问国,安徽省,001607220057259812,
290,,佛山蓝烽科技有限公司,范锦东,广东省,001607220057251905,
291,,湘潭金石装饰设计有限公司,刘朝晖,湖南省,001607220057206045,
292,91450100599800417D,广西中装联盟装饰集团有限公司,赵宇灿,广西壮族自治区,001607220057367799,
293,914500001982216845,广西通信规划设计咨询有限公司,何曲,广西壮族自治区,001607220057289780,
294,91450100768929466W,广西土木勘察检测治理有限公司,兰昕刚,广西壮族自治区,001607220057365011,
295,91440101675688704F,广东中余建设集团有限公司,徐泽光,广东省,001607220057304041,
296,91440101585676865Y,广东恒坤建设工程有限公司,黄武盛,广东省,001607220057284471,
297,,广州申伯装饰设计有限公司,张令玉,广东省,001607220057271331,
298,91440113775677746J,广州市盛州建筑工程有限公司,杨楚兰,广东省,001607220057346235,
299,913307827309214185,浙江飞龙装饰工程有限公司,刘绍龙,浙江省,001607220057243648,
300,91110116742301232H,北京科华国际幕墙工程有限公司,黄文金,北京市,001607220057397631,
316,,高要市建安建筑工程有限公司,薛志辉,广东省,001607220057222584,
320,913101156916270989,上海匠城建筑装饰设计工程有限公司,王俊,上海市,001607220057294235,
321,,北京北控物业管理有限责任公司,米云平,北京市,001607220057374496,
322,91440803617801692J,广东万建建筑工程有限公司,陈维年,广东省,001607220057264454,
323,,江苏朝阳智能化技术有限公司,李桂华,江苏省,001607220057355673,
324,91330226561284875K,宁波东元生态建设有限公司,夏晓锋,浙江省,001607220057390246,
325,91350182689392584K,福建民生建设工程有限公司,陈义,福建省,001607220057350375,
326,,河南奥飞声学灯光科技有限公司,孙守红,河南省,001607220057389379,
327,,郑州步真装饰工程有限公司,邓岚,河南省,001607220057318972,
328,91410105580321563K,河南中海湾消防工程有限公司,高枫,河南省,001607220057256876,
329,91370400740982636C,山东三维钢结构股份有限公司,杨维生,山东省,001607220057394935,
330,914101002680842847,河南银田装饰工程有限公司,董晓博,河南省,001607220057204901,
346,91410724675381788N,河南恒生建筑安装有限公司,高巨模,河南省,001607220057222565,
349,913302007342813661,浙江大丰实业股份有限公司,丰华,浙江省,001607220057391651,
352,,惠州市穗南电力技术改进工程有限公司,王华,广东省,001607220057215522,
353,,苏州市力及建筑装饰工程有限公司,张介龙,江苏省,001607220057223296,
354,,广州市典雅艺术文化传播有限公司,彭国练,广东省,001607220057348144,
355,914401047371738034,广州宝泰建筑设计工程有限公司,黄健程,广东省,001607220057275790,
356,914401065780053348,广州集置建筑装饰有限公司,魏琪敏,广东省,001607220057201974,
360,915000006733937772,重庆臻达装饰工程有限公司,陈德伍,重庆市,001607220057302246,
361,,洛阳广亚装饰工程有限公司,李文彬,河南省,001607220057202257,
362,,河南汇利装饰有限公司,郭学青,河南省,001607220057262702,
363,,浙江盈策科技有限公司,姚则余,浙江省,001607220057329703,
364,91310118593123152T,上海立润建设有限公司,季忠宇,上海市,001607220057242164,
365,,上海华固特种门窗有限公司,陶良华,上海市,001607220057302229,
366,913102305947542121,申鹄建筑装饰工程（上海）有限公司,韦国宏,上海市,001607220057252995,
367,913101187033381559,上海万坤企业发展有限公司,沙钢,上海市,001607220057245921,
368,913205927265438802,江苏省安发工程技术有限公司,郁海仁,江苏省,001607220057313337,
369,91411300057230210W,南阳市盛昌装饰工程有限公司,杨林昌,河南省,001607220057392756,
370,914115227932333489,光山县美丽家园装潢工程有限公司,曹永明,河南省,001607220057351487,
371,91310115703339254P,上海金曜电子工程有限公司,蔡炜东,上海市,001607220057277402,
372,91411000568643375H,河南亚东装饰有限公司,刘亚东,河南省,001607220057315167,
373,911101016932311269,北京尚居建筑装饰工程有限公司,仇昌岳,北京市,001607220057229951,
374,91110105600001496R,积水建设工程（北京）有限公司,林真一,北京市,001607220057200981,
375,9137000073927793X0,山东鲁咨工程咨询有限公司,张玲,山东省,001607220057320494,
376,91350800662849556B,福建大恒建设工程有限公司,范静,福建省,001607220057297990,
377,,河南省新盛建筑节能装饰有限公司,张新建,河南省,001607220057278443,
380,91320104768159238X,江苏九瑞幕墙工程有限公司,王施琴,江苏省,001607220057366447,
381,,上海菱海建筑装潢有限公司,陈必良,上海市,001607220057321682,
382,,肇庆市东方红装饰设计工程有限公司,余海兴,广东省,001607220057281310,
383,914401166915139041,广州新和环境建设有限公司,谢景琳,广东省,001607220057366386,
384,91440101783751176L,广州大鹏建筑工程有限公司,刘鹏,广东省,001607220057395986,
385,,广东成悦装饰工程有限公司,曾毓盛,广东省,001607220057377304,
386,,广州轩昂装饰工程有限公司,刘兴林,广东省,001607220057279892,
387,91440113665904805F,广东凯华净化科技有限公司,王文忠,广东省,001607220057283802,
388,,广州市枫华建筑装饰设计工程有限公司,江亮,广东省,001607220057198996,
389,,广州艺卓机电工程有限公司,殷国强,广东省,001607220057206981,
390,91440106554400487M,广州英乔装饰工程有限公司,黄永祥,广东省,001607220057349355,
412,91440000190383136K,广东粤铝建筑装饰有限公司,刘金刚,广东省,001607220057227258,
413,,东莞市粤泰装饰有限公司,邬晶晶,广东省,001607220057330810,
414,,惠州市瀛海装饰工程有限公司,钟镇宇,广东省,001607220057319088,
415,91440101739736059M,广州力洋建设工程有限公司,徐中艳,广东省,001607220057234406,
416,,广州雷格设计有限公司,吴智华,广东省,001607220057321692,
417,91440105569752047A,广州康建建筑装饰工程有限公司,李伟平,广东省,001607220057298207,
418,914408007606106969,广东明量工程有限公司,岑发广,广东省,001607220057284806,
419,914303007903057215,湘潭市煤田地质科技工程有限公司,楚慧平,湖南省,001607220057252676,
420,914511000654291669,广西旺达建工有限公司,彭福站,广西壮族自治区,001607220057275531,
