181,91150105761058485D,内蒙古惠泽工程造价咨询有限责任公司,王淑梅,内蒙古自治区,001706140150055539,
182,91150700720106209U,内蒙古中建鼎信工程项目管理有限公司,吴桂江,内蒙古自治区,001706140150055540,
183,913304017384064614,嘉兴市银建工程咨询评估有限公司,王政,浙江省,001706140150055541,
184,,北京华泰诚建设项目管理咨询有限公司,李栋,北京市,001706140150055543,
185,9144010666593609X7,广州翔实工程咨询有限公司,叶秀颜,广东省,001706140150055544,
186,9131011876534389XU,上海城测工程造价咨询有限公司,袁东华,上海市,001706140150055545,
187,,河北沧海石化工程有限公司,刘金山,河北省,001706140150055546,
188,91360700767020218G,赣州市正达工程造价咨询有限公司,蒙一峰,江西省,001706140150055547,
189,91130403741512337H,邯郸市诚信招投标代理有限责任公司,王玉学,河北省,001706140150055548,
190,91500000902819736J,中国建设银行股份有限公司重庆市分行,王晓永,重庆市,001706140150055549,
191,91330000717610463E,浙江省成套招标代理有限公司,钱培良,浙江省,001706140150055550,
192,916201027623566953,甘肃中信工程咨询有限公司,陈婕,甘肃省,001706140150055551,
193,911401007858109263,山西岁渊工程造价咨询有限公司,李胜,山西省,001706140150055552,
194,911411817460327895,山西方超工程造价咨询有限责任公司,郑玉巧,山西省,001706140150055553,
195,91330000751180348J,浙江中恒工程造价咨询有限公司,王本炎,浙江省,001706140150055554,
271,91510000779814007X,四川志和工程咨询管理有限公司,刘勇,四川省,001706140147052985,
272,,青岛青咨工程咨询有限公司,钟晖,山东省,001706140147052987,
273,915101087253933234,成都励精工程项目管理有限公司,高静,四川省,001706140147052988,
274,915100007866856290,四川信诚工程咨询有限公司,段昆朋,四川省,001706140147052989,
275,91450100711408045P,桂诚工程造价咨询事务有限责任公司,吴俊毅,广西壮族自治区,001706140148053450,
276,,湖北安永信工程咨询管理有限责任公司,汪战彪,湖北省,001706140148053451,
277,911309006011947362,河北今创工程项目管理有限公司,潘洪亮,河北省,001706140148053452,
278,91440116737171103A,广州筑正工程建设管理有限公司,王秋生,广东省,001706140148053453,
279,91440106728197811C,广东至衡工程管理有限公司,曾宪威,广东省,001706140148053454,
280,91360000158263599J,中国瑞林工程技术有限公司,章晓波,江西省,001706140148053455,
281,,无锡中天造价师事务所有限公司,周益民,江苏省,001706140148053456,
282,,安徽同升工程管理咨询有限责任公司,王志敏,安徽省,001706140148053457,
283,,陕西建工项目管理有限公司,李鹏军,陕西省,001706140148053458,
284,,西安普迈项目管理有限公司,王斌,陕西省,001706140148053459,
285,91320000772033080F,江苏天衡工程咨询管理有限公司,狄云龙,江苏省,001706140148053461,
